8473;Кондитерскиеизделия1000;Шоколад Alpen Gold Клубника/йогурт 85гр. 1/21;90.0
8472;Кондитерскиеизделия1000;Шоколад Alpen Gold Молочный 85гр. 1/22;90.0
8471;Кондитерскиеизделия1000;Шоколад Alpen Gold Арахис/кукур.хлопья 85гр. 1/21;90.0
8470;Кондитерскиеизделия1000;Шоколад Alpen Gold темный и белый шоколад 85гр.1/21;90.0
8469;Кондитерскиеизделия1000;Шоколад Alpen Gold Фундук 85гр. 1/21;90.0
8467;Кондитерскиеизделия1000;Шоколадный батончик  Кит-Кат  40 гр/35;67.0
8466;Кондитерскиеизделия1000;Шоколадный батончик  Кит-Кат  Трио 87 гр/20;143.0
8464;Кондитерскиеизделия1000;Шоколад Alpen Gold Темный c фундуком 80гр. 1/22;90.0
8462;Кондитерскиеизделия1000;Шоколад Alpen Gold Соленый арахис/крекер 85гр. 1/21;90.0
8461;Кондитерскиеизделия1000;Шоколад Alpen Gold Соленый миндаль/карамель 85гр 1/21;90.0
8459;Кондитерскиеизделия1000;Шоколад Alpen Gold OREO Молочный нежная клубника и кус Орео 90 гр. 1/19;90.0
8456;Кондитерскиеизделия1000;Шоколад Воздушный  Молочный пористый  85гр.1/20;72.0
8454;Кондитерскиеизделия1000;Шоколад Воздушный  Темный пористый  85гр.1/20;72.0
8452;Кондитерскиеизделия1000;Шоколад  Марс  81 гр/24/7;98.0
8450;Кондитерскиеизделия1000;Сникерс Криспер 60гр 1/24/7;49.0
8448;Кондитерскиеизделия1000;Шоколад Alpen Gold Белый минд/кокос 85гр.1/21;90.0
8447;Кондитерскиеизделия1000;Шоколад  Сникерс   50 гр 48/6/288;59.0
8442;Кондитерскиеизделия1000;Шоколад  Сникерс  81 гр лесной орех 1/32/5;81.0
8440;Кондитерскиеизделия1000;Шоколадный батончик  Кит-Кат  169гр 1/10;273.0
8436;Кондитерскиеизделия1000;Шоколад Alpen Gold сушен.инжиркокос.стружкасолен.крекер 85гр 1/20;90.0
8433;Кондитерскиеизделия1000;Шоколадный батончик  Натс Мегабайт  66 гр/24;105.0
8431;Кондитерскиеизделия1000;Шоколад  Баунти  55 гр/32/6/192;59.0
8430;Кондитерскиеизделия1000;Шоколад Воздушный  Белый пористый  85гр.1/20;72.0
8429;Кондитерскиеизделия1000;Шоколад Alpen Gold OREO 90гр 1/19;90.0
8428;Кондитерскиеизделия1000;Шоколадный батончик  Натс Фундук  50 гр/30;73.0
8424;Кондитерскиеизделия1000;Шоколад  Баунти  825 гр/24/6;94.0
8422;Кондитерскиеизделия1000;Шоколадный батончик  Кит-Кат Кинг сайз два 58гр/35;104.0
8421;Кондитерскиеизделия1000;Шоколад  Сникерс  95 гр 32/4 супер;81.0
7621;Кондитерскиеизделия1000;Конф_вес_ Ласточка вестница весны в/з 1/250 1/24;100.0
7620;Кондитерскиеизделия1000;Конф_вес_ РОМАШКА в/з 1/250 1/24;115.0
7598;Кондитерскиеизделия1000;Конф.вес. Морской бриз фас.0250 кг 1/24;103.0
5518;Кондитерскиеизделия1000;Вафельный батончик Нутелла Б-реди Т1х15х2 22г;45.0
5105;Кондитерскиеизделия1000;Ирис Сказка Золотой ключик в/з 300гр 1/18;112.0
5085;Кондитерскиеизделия1000;Ирис Сказка Кис-Кис в/з 300гр 1/18;112.0
4751;Кондитерскиеизделия1000;Миндаль в шоколадной глазури ассорти 150гр 1/12 ТМ  Seven Nuts;131.0
4749;Кондитерскиеизделия1000;Фундук жареный 100гр 1/12 ТМ  Seven Nuts;187.0
4315;Кондитерскиеизделия1000;Мармелад жевательный фигурный  Зоопарк  70гр 1*12*36;49.0
4312;Кондитерскиеизделия1000;Мармелад жевательный фигурный  Cola  70гр 1*12*36;49.0
4311;Кондитерскиеизделия1000;Мармелад жевательный фигурный  Веселые мишки  70гр 1*12*36;40.0
4309;Кондитерскиеизделия1000;Мармелад желейный со вкусом  Малины  300гр 1/12;132.0
4308;Кондитерскиеизделия1000;Мармелад желейный со вкусом  Лимона  300гр 1/12;132.0
4307;Кондитерскиеизделия1000;Мармелад желейный со вкусом  Яблока  300гр 1/12;132.0
4302;Кондитерскиеизделия1000;Халва подсолн. 250гр 1/20;101.0
4283;Кондитерскиеизделия1000;Кукурузные хлопья без сахара пак. 325гр  На здоровье  1/10;113.0
4281;Кондитерскиеизделия1000;Кукурузные хлопья 350гр пак.  На здоровье  1/10;120.0
3839;Кондитерскиеизделия1000;Шоколад  M&M  с шоколадом 45гр 32/6;60.0
3814;Кондитерскиеизделия1000;Шоколад  M&M  с арахисом 45 гр 32/5;60.0
3623;Кондитерскиеизделия1000;Сухой завтрак  Супер Хрупер  Медвежата шоколадные 200гр 1/16;110.0
3622;Кондитерскиеизделия1000;Сухой завтрак  Супер Хрупер  Шарики шоколадные 200гр 1/16;110.0
3132;Кондитерскиеизделия1000;Подушечки  Супер Хрупер  зерн. из 5 злаков с молочной начинкой 250гр 1/16;97.0
3120;Кондитерскиеизделия1000;Попкорн зерно для СВЧ  Соль  90гр 1/60;36.0
3064;Кондитерскиеизделия1000;Раффаэлло Т9 90гр 1/12;233.0
2656;Кондитерскиеизделия1000;Гель д/душа детский  Солнце и Луна  Мармеладный 200 мл 1/12 для девочек;91.0
