13071;Кондитерскиеизделия1000;Печенье сахарное  FUNNY CAT  с какао и нач. с аром. ванили 42 гр 1/20;27.0
12980;Кондитерскиеизделия1000;Твикс 165гр (3*55гр) 1/18;158.0
12979;Кондитерскиеизделия1000;PLAY ME ZOMБАКИ кукурузные шарик с игрушкой 50гр 16;174.0
12977;Кондитерскиеизделия1000;ШОКИ-ТОКИ ТУРБОЗАВРЫ шоко.яйцо с сюрпризом 20гр 24/6;88.0
12975;Кондитерскиеизделия1000;Яйцо шоколадное с игрушкой Шоки-Токи Тачки 20 г;123.0
12974;Кондитерскиеизделия1000;PLAY ME РОБОТЕХНИКИ сладкий попкорн с игрушкой 50гр 16;174.0
12973;Кондитерскиеизделия1000;FRUITLS MAXI щенячий патруль в плас.яйце с подарком 10гр 8/6;292.0
12972;Кондитерскиеизделия1000;CAVE CLUB Хлеб/палочки с м/пастой вкус малины c сюрпр.85гр/36;110.0
12971;Кондитерскиеизделия1000;44 CATS мармелад жевательный 85гр 15/6;65.0
12970;Кондитерскиеизделия1000;Ментос Ролл XXL 8*24 233 г;71.0
12969;Кондитерскиеизделия1000;Милки Вей подарочный набор ВЕСНА 81гр 1/16;143.0
12968;Кондитерскиеизделия1000;Мини-рулеты бисквит. Мастер Десерта  35г*4 1/24 Вареная сгущенка;26.0
12967;Кондитерскиеизделия1000;Набор конфет  Колибри  ассорти 120гр 1/12 бирюзовая кор;170.0
12966;Кондитерскиеизделия1000;Конфета-плитка  BonBons  со вкусом тоффи 115гр 1/63;68.0
12965;Кондитерскиеизделия1000;Конфета-плитка  BonBons  со вкусом апельсина 115гр 1/63;68.0
12962;Кондитерскиеизделия1000;Конфета-плитка  BonBons  с арахисом и начинкой какао 115гр 1/63;68.0
12961;Кондитерскиеизделия1000;SWEET BAR карамель на палочке арбузик 40гр/15/4;67.0
12960;Кондитерскиеизделия1000;SWEET BAR карамель на палочке ананас 40гр/15/4;71.0
12959;Кондитерскиеизделия1000;PLAY ME БУБА сладкий попкорн с игрушкой 50гр/16;200.0
12958;Кондитерскиеизделия1000;Сладкая шипучка Шипелка в фигурном пакете с подарком в ассорт 5гр/40/6;38.0
12957;Кондитерскиеизделия1000;МИ-МИ-МИШКИ набор для пускания мыльных пузырей 50мл/12/12;57.0
12956;Кондитерскиеизделия1000;МАША И МЕДВЕДЬ драже в градуснике 8гр/30/20;29.0
12955;Кондитерскиеизделия1000;Кидсбокс CAVE CLUB десерт с подарком 20гр/16/6;122.0
12954;Кондитерскиеизделия1000;Кидсбокс МИНЬОНЫ десерт с подарком 20гр/16/6;122.0
12953;Кондитерскиеизделия1000;БУБАМИ-Ми-МИШКИ/ЛЕДИ БАГ/ВСПЫШ маршмелки в форме трубочки 12гр/30/12;22.0
12952;Кондитерскиеизделия1000;LOL зефир в пакетиках Зефирка 25гр/24/8;56.0
12951;Кондитерскиеизделия1000;Кукурузные шарики PLAY ME 44 CATS с какао с игрушкой 50 гр/16;204.0
12950;Кондитерскиеизделия1000;СМЕШАРИКИ зефир В ПАКЕТИКЕ  Зефирка  25гр/24/8;56.0
12949;Кондитерскиеизделия1000;ENCHANTIMALS зефирная косичка со вкусом клубники 40гр/30/4;98.0
12948;Кондитерскиеизделия1000;Дисней микс Принцесса/Тачки Фруктовые пас.в плас.яйце 5г 6/12;126.0
12947;Кондитерскиеизделия1000;Меллер с шоколадом 1/24*8бл 38гр;51.0
12929;Кондитерскиеизделия1000;HOT WEELS карамель с игрушкой в пласт.шаре 15гр/12/6;1.0
12873;Кондитерскиеизделия1000;Зефир в глаз. Funny Cat 372гр 1/10;284.0
12731;Кондитерскиеизделия1000;Чоко-Бой Карамель 100гр. 1/15;137.0
12704;Кондитерскиеизделия1000;Чоко Пай Дарк 30гр 12шт 1/8;251.0
12465;Кондитерскиеизделия1000;Конфеты Батончики с орехом 250гр 1/24;164.0
12455;Кондитерскиеизделия1000;Конфеты Батончики  Полюшко  в/з 300гр 1/18;114.0
12454;Кондитерскиеизделия1000;Конфеты Мишка косолапый в/з 200гр 1/20;271.0
12208;Кондитерскиеизделия1000;Рулет бискв.  Севен Дейс  300 г. 1/10 Клубника;113.0
12207;Кондитерскиеизделия1000;Рулет бискв.  Севен Дейс  300 г. 1/10 Какао;113.0
11874;Кондитерскиеизделия1000;Чоко Пай Дарк Карамель 30гр 12шт 1/8;251.0
11622;Кондитерскиеизделия1000;ТИГРЯТА мармелад в плас.яйце с игрушкой 10гр 12/6;100.0
11621;Кондитерскиеизделия1000;СВИНКА ПЕППА мармелад жев.фруктовое ассорти 25гр 24/8;27.0
11606;Кондитерскиеизделия1000;Царевны мармелад с игрушкой в коробочке 10 гр;171.0
11421;Кондитерскиеизделия1000;Халва подсолн. с арахисом 250гр 1/20;103.0
11264;Кондитерскиеизделия1000;MMs 80гр с арахисом 1/28;110.0
11262;Кондитерскиеизделия1000;MMs 145гр с арахисом 1/18;0.0
11165;Кондитерскиеизделия1000;Попкорн зерно для СВЧ  Сыр  90гр 1/60;36.0
10759;Кондитерскиеизделия1000;Пирожные бисквитные FUNNY BUNNY с начинкой карамельной 150гр 1/12;127.0
10400;Кондитерскиеизделия1000;Хлопья овсяные  Кашка-Минутка  с малиной и сливками 215гр 1/16;122.0
10398;Кондитерскиеизделия1000;Хлопья овсяные  Кашка-Минутка  с персиком и сливками 215гр 1/16;122.0
10329;Кондитерскиеизделия1000;Хлопья овсяные быстр.приг.  Кашка-Минутка  с черникой со слив. вкусом 215гр 1/16;103.0
9470;Кондитерскиеизделия1000;Карамель  Лакомка  вареная сгущенка 200гр 1/30;87.0
9467;Кондитерскиеизделия1000;Конфеты Рафаэлло плоская 240 гр. 1/6;523.0
9460;Кондитерскиеизделия1000;Конфеты глаз. Фанты-банты  200гр 1/20;82.0
9458;Кондитерскиеизделия1000;Конфеты глаз. Малинковъ со вкусом малины 200гр 1/18 1/20;76.0
9457;Кондитерскиеизделия1000;Карамель  Веселая семейка  микс 200гр 1/30;83.0
9447;Кондитерскиеизделия1000;Конфеты  Антошка Картошка  ваниль фас 250гр 1/24;112.0
9440;Кондитерскиеизделия1000;Конфеты  Антошка Картошка  шоколад фас 250гр 1/24;112.0
9437;Кондитерскиеизделия1000;Конфеты  Раффаэлло   150гр. 1/6;320.0
9407;Кондитерскиеизделия1000;Карамель  Лакомка  взбитые сливки 200гр 1/30;87.0
9379;Кондитерскиеизделия1000;Конфеты глаз. Клубничковъ со вкусом клубники 200гр 1/18 1/20;76.0
9366;Кондитерскиеизделия1000;Раффаэлло конфеты с минд Т7х20 70гр;151.0
9347;Кондитерскиеизделия1000;Конфеты глазир.  Супер мышь  200гр 1/20;65.0
9333;Кондитерскиеизделия1000;Карамель МИНИ МИКС 200гр 1/30 с желейной нач. Жили-Были Карамельки  клюквамалиначерная смородина;65.0
9327;Кондитерскиеизделия1000;Конфеты желейные Задорная пчёлка (микс) неглаз. 250гр 1/16;118.0
9324;Кондитерскиеизделия1000;Карамель леденц. Пчёлка (микс) мини 180гр 1/22;80.0
9323;Кондитерскиеизделия1000;Конфеты жевательные Мусики (микс) 180гр 1/16;97.0
9322;Кондитерскиеизделия1000;Конфеты жевательные Fruzzy Duo (микс) с нач. 180гр 1/22;95.0
9321;Кондитерскиеизделия1000;Конфеты глаз. с комб.корп.  Imperio  вкус Изабелла 250гр 1/18;80.0
9320;Кондитерскиеизделия1000;Конфеты глаз. с комб.корп.  Imperio  вкус Амаретто 250гр 1/18;80.0
9314;Кондитерскиеизделия1000;Конфеты глаз.  CAO  с кремовым корп.с трюфельным вкусом 170гр 1/10;84.0
9308;Кондитерскиеизделия1000;Конфеты Рафаэлло торт средний 1/200 Т20*4;589.0
9301;Кондитерскиеизделия1000;Сушки  Посольские  Ваниль 02 кг 1/25;74.0
9298;Кондитерскиеизделия1000;Сухари  Посольские  Ваниль 0250 кг 1/16;93.0
9289;Кондитерскиеизделия1000;Пирог сырный  Чизкейк Вишня и Шоколад  мини 500гр 1/1;567.0
9284;Кондитерскиеизделия1000;Сухари  Посольские  с изюмом 0250 кг 1/16;98.0
9278;Кондитерскиеизделия1000;Сушки  Посольские  Глазированные 02 кг 1/25;64.0
9237;Кондитерскиеизделия1000;Пряник Тульский с нач вареная сгущенка 140гр 1/22 1/52;60.0
9232;Кондитерскиеизделия1000;Пряник Ладушки Крем сливки 350гр 1/8 1/12;127.0
9231;Кондитерскиеизделия1000;Пряник Ладушки с шоколадным вкусом 350гр 1/12;127.0
9230;Кондитерскиеизделия1000;Пряник Ладушки Провинциальные 350гр 1/8 1/12;127.0
9226;Кондитерскиеизделия1000;Пряник Тульский с фруктовой начинкой 140гр 1/22 1/52;60.0
9196;Кондитерскиеизделия1000;Торт бисквитный Добрая мама 350гр 1/6;199.0
9191;Кондитерскиеизделия1000;Пирож. Медвеж.Барни шоколадный с ореховым вкусом 1/20 150гр;170.0
9189;Кондитерскиеизделия1000;Пирож. Медвеж.Барни молочный 1/20 150гр;170.0
9165;Кондитерскиеизделия1000;Рулет бискв.  Севен Дейс  300 г. 1/10 Ягодное ассорти;113.0
9164;Кондитерскиеизделия1000;Рулет бискв.  Севен Дейс  300 г. 1/10 Вареная сгущенка;113.0
9158;Кондитерскиеизделия1000;Рулет Домашний 150гр 1/15 Клубника;64.0
9155;Кондитерскиеизделия1000;Рулеты бисквитные Аленка вкус Сливочная карамель 210гр 1/12;170.0
9153;Кондитерскиеизделия1000;Рулет бисквитный Аленка вкус Молочный шоколад 200гр 1/15;97.0
9127;Кондитерскиеизделия1000;Круассаны  Севен Дейс  105 г. 1/18 Клубника;58.0
9124;Кондитерскиеизделия1000;Печенье  Юбилейное  112гр Витамин. молочное 1/60;55.0
9115;Кондитерскиеизделия1000;Чоко Пай №6 (1/16) Orion;115.0
9098;Кондитерскиеизделия1000;Печенье  Юбилейное  112гр Витамин. традиционное 1/60;55.0
9095;Кондитерскиеизделия1000;Печенье сахарное  FUNNY CAT  с какао и нач. с аром. ванили 158 гр 1/9;71.0
9048;Кондитерскиеизделия1000;Печенье OREO 95 гр 1/28 с какао и клубничной начинкой;88.0
9041;Кондитерскиеизделия1000;Печенье сахарное  Коровка  со сливочным маслом и глазурью 115гр 1/30 Самойлова КФ;44.0
9040;Кондитерскиеизделия1000;Печенье сахарное  Коровка  с молоком 375гр 1/18 Самойлова КФ;103.0
9038;Кондитерскиеизделия1000;Печенье сахарное  Коровка  с какао и глазурью 115гр 1/30 Самойлова КФ;65.0
9013;Кондитерскиеизделия1000;Чоко Пай вишня 360гр 12шт 1/8;272.0
9005;Кондитерскиеизделия1000;Печенье сахарное  Топлёное молоко  290гр 1/14;85.0
9004;Кондитерскиеизделия1000;Печенье сахарное  Сливочное  280гр 1/14;83.0
9003;Кондитерскиеизделия1000;Печенье сахарное  Ростовское  280гр 1/14;84.0
9002;Кондитерскиеизделия1000;Печенье сахарное  Молочно-шоколадное  290гр 1/14;91.0
8997;Кондитерскиеизделия1000;Чоко пай №12 (1/8) Orion;221.0
8954;Кондитерскиеизделия1000;Печенье сахарное  FUNNY CAT  с какао и нач. с аром. ванили 95 гр 1/15;59.0
8941;Кондитерскиеизделия1000;Печенье Овсяное 5 злаков 250 гр 1/16;100.0
8930;Кондитерскиеизделия1000;Печенье  Юбилейное  116гр Молочное с молочной глазурью 1/60;76.0
8923;Кондитерскиеизделия1000;Печенье OREO 95 гр 1/28 Ваниль;88.0
8907;Кондитерскиеизделия1000;Рафаэлло торт 1/100 Т10*6;332.0
8891;Кондитерскиеизделия1000;Бигбабол Клубника ж/р 21гр 1/24шт*16;26.0
8889;Кондитерскиеизделия1000;Ментос Ролл Pure Fresh Тутти-Фрутти 155гр 1/24шт*12;49.0
8888;Кондитерскиеизделия1000;Паста шок.-ор Бурешка 350гр пл 1/12;127.0
8884;Кондитерскиеизделия1000;Тик Так Ягодный микс 16гр 1/24/12бл;56.0
8880;Кондитерскиеизделия1000;Тик Так драже Клубника 1/24/12бл;0.0
8879;Кондитерскиеизделия1000;Тик Так драже Мята 1/24/12бл;0.0
8878;Кондитерскиеизделия1000;Чоко-Бой 45гр. Орион 1/30;68.0
8875;Кондитерскиеизделия1000;Жевательная конфета SKITTLES КислоМикс 70гр 1/26;82.0
8874;Кондитерскиеизделия1000;Жевательная конфета SKITTLES Фрукты 70гр 1/26;82.0
8871;Кондитерскиеизделия1000;Ментос Ролл Pure Fresh Арбуз 155гр 1/24шт*12;33.0
8869;Кондитерскиеизделия1000;Драже жевательные Ментос Кола 37гр 1/21шт*18;78.0
8868;Кондитерскиеизделия1000;Ментос Ролл Pure Fresh Свежая Мята 155гр 1/24*12;49.0
8867;Кондитерскиеизделия1000;Жевательная резинка Бигбабол Банан 21гр 1/24*16;37.0
8866;Кондитерскиеизделия1000;Жевательная конфета SKITTLES КислоМикс 38 гр. 1/12;49.0
8864;Кондитерскиеизделия1000;Чоко Бой 100гр 1/15 Орион;137.0
8860;Кондитерскиеизделия1000;Паста шок.-мол. Бурешка Дуо 350гр пл. 1/12;139.0
8858;Кондитерскиеизделия1000;Чоко-Бой Карамель 45гр. 1/30;69.0
8852;Кондитерскиеизделия1000;Жевательная конфета SKITTLES Фрукты 38 гр. 1/12;49.0
8849;Кондитерскиеизделия1000;Ментос карамельное яблоко 37гр 1/21шт*18;51.0
8833;Кондитерскиеизделия1000;Фруттелла Клубника Йогрут 41гр 1/21*9бл;72.0
8822;Кондитерскиеизделия1000;PLAY ME Кукурузные шарики ЛЕДИ БАГ (какао) с игрушкой 1*16 50г;174.0
8818;Кондитерскиеизделия1000;PLAY ME Энчантичалс слад.попкорн с игрушкой 50гр 1/16;200.0
8816;Кондитерскиеизделия1000;PLAY ME Вспыш и Чудо-Машины шок.шарики и игрушки 50гр 1/16;174.0
8815;Кондитерскиеизделия1000;PLAY ME КОТОСАД шок.шарики с игрушкой 50гр/16;122.0
8814;Кондитерскиеизделия1000;PLAY ME ДВОРНЯШКИ шок.шарики с игрушкой 50гр/16;174.0
8813;Кондитерскиеизделия1000;PLAY ME БУБА шоколадные шарики с игрушкой 50гр/16;174.0
8811;Кондитерскиеизделия1000;PLAY ME LOL шоколадные шарики с игрушкой 50гр/16;152.0
8799;Кондитерскиеизделия1000;Свитбокс мармелад ПУШИСТИКИ ЩЕНЯТА супергерои с игрушкой в коробочке 10гр/10/12;137.0
8797;Кондитерскиеизделия1000;Шоколадный шар Чупа Чупс Лунтик 20гр 1/18*8;144.0
8795;Кондитерскиеизделия1000;Фруттелла Молочные коровки мармелад 65гр 1/30;71.0
8792;Кондитерскиеизделия1000;Чупа-Чупс Ассорти 10 гр.;23.0
8790;Кондитерскиеизделия1000;Фруттелла Ассорти 41гр 1/21*9бл;72.0
8788;Кондитерскиеизделия1000;Шоколадный шар Чупа Чупс Скуби Ду 20гр 1/18*8;144.0
8772;Кондитерскиеизделия1000;МЫШКИН ДОМ мармелад с игрушкой в коробке 10гр/10/12 свитбокс;136.0
8768;Кондитерскиеизделия1000;PLAY ME КОТОСАД шоколадные шарики с игрушкой 50гр/6/10;174.0
8766;Кондитерскиеизделия1000;Чупа-Чупс Ассорти 29 гр.;34.0
8761;Кондитерскиеизделия1000;Тарталетки из песочного теста  оригинальные  180гр 1/12;121.0
8725;Кондитерскиеизделия1000;Пирог песочный с абрикосовым джемом  Kovis  430гр 1/6;214.0
8722;Кондитерскиеизделия1000;Немецкий вишневый пирог  Kuchen  350гр 1/8 (Baker House);215.0
8720;Кондитерскиеизделия1000;Пирожные сдобные.(Колечки) с кремом варёная сгущенка  KOVIS  240гр 1/6;152.0
8719;Кондитерскиеизделия1000;Рулет  Ковис  175гр Клубника 1/15;65.0
8714;Кондитерскиеизделия1000;Пирожные  Птифур  225 гр 1/10 Карамель с арахисом (Baker House);232.0
8707;Кондитерскиеизделия1000;Мини - Тарты  Baker House  с карамельно - арахисовой начинкой 240гр * 8шт;155.0
8677;Кондитерскиеизделия1000;Вафельные  Трубочки  Яшкино лесной орех 190гр 1/24 КВ328;79.0
8675;Кондитерскиеизделия1000;Вафли глазированные Яшкино с орешками 0.200гр 1/27;116.0
8674;Кондитерскиеизделия1000;Печенье сдобное Яшкино  Апельсин  0.137гр 1/24;79.0
8661;Кондитерскиеизделия1000;Печенье сдобное Яшкино  Клубника  137гр 1/24;79.0
8649;Кондитерскиеизделия1000;Вафли Яшкино 200гр 1/24 сливочные;84.0
8648;Кондитерскиеизделия1000;Вафли Яшкино 200гр 1/24 с вареной сгущенкой;66.0
8646;Кондитерскиеизделия1000;Вафельные  Трубочки  Яшкино сгущеное молоко 190гр 1/24 КВ329;76.0
8645;Кондитерскиеизделия1000;Печенье сдобное Яшкино  Вишня  0.137гр 1/24;79.0
8641;Кондитерскиеизделия1000;Мерси лесной орех/миндал 100 гр. 1/15;193.0
8635;Кондитерскиеизделия1000;А.Коркунов 110гр Ассорти тем мол 1/14;364.0
8634;Кондитерскиеизделия1000;А.Коркунов 192гр Ассорти тем мол 1/10;447.0
8632;Кондитерскиеизделия1000;А.Коркунов 90гр Горьк Шок 55% 1/14;214.0
8626;Кондитерскиеизделия1000;А.Коркунов 110гр колл.мол шок 1/10;315.0
8624;Кондитерскиеизделия1000;Мерси шоколад молочный с цел.орех 100гр 1/15;198.0
8622;Кондитерскиеизделия1000;А.Коркунов 192гр Коллекция тем.шоколада 1/10;368.0
8620;Кондитерскиеизделия1000;Молочный шоколад Dove цельн.фундуком 1/16;192.0
8619;Кондитерскиеизделия1000;Молочный шоколад Dove молочный 90гр 1/16;163.0
8610;Кондитерскиеизделия1000;Шоколад Dove 90гр молочный фундук 1/16;129.0
8602;Кондитерскиеизделия1000;Шоколад темный Экселленс 70% (Какао) 100гр 1/20;181.0
8586;Кондитерскиеизделия1000;Шоколад Dove 90гр молочный фундук/изюм 1/16;129.0
8576;Кондитерскиеизделия1000;Шоколадно-ореховая паста + хлебные палочки  Nutella  1/12;99.0
8569;Кондитерскиеизделия1000;КИДСБОКС ОРАНЖЕВАЯ КОРОВА Десерт с подарком 6/16 20 г;98.0
8568;Кондитерскиеизделия1000;Кидсбокс Disnet Marvel Fruitls фруктовые пастилки с подарком 5 гр;98.0
8565;Кондитерскиеизделия1000;Шоколад  Твикс  55 гр. 40/6/240;59.0
8564;Кондитерскиеизделия1000;Шоколад  Милки Вей  176 гр Минис 1/9;222.0
8561;Кондитерскиеизделия1000;Вафли Киндер Буено в мол.шок. 43гр 1/30;76.0
8553;Кондитерскиеизделия1000;МДМ 36гр криспи 1/32/6;51.0
8552;Кондитерскиеизделия1000;Киндер Джой Звездные Войны мальчики 20гр 1/24;125.0
8551;Кондитерскиеизделия1000;Киндер Джой Миркл 20гр 1/24;125.0
8545;Кондитерскиеизделия1000;Вафли киндер Буено в белом шоколаде 39гр 1/30;76.0
8535;Кондитерскиеизделия1000;Киндер шоколад со злаками Т4 94гр 1/24;172.0
8524;Кондитерскиеизделия1000;Шоколад  Твикс  55гр солёная карамель 1/40/6;59.0
8517;Кондитерскиеизделия1000;Киндер Делис 42гр 1/20;65.0
8510;Кондитерскиеизделия1000;Шоколад  Твикс  82 гр/24/6 Экстра;98.0
8506;Кондитерскиеизделия1000;Шоколад  Милки Вей  26 гр Клубничный коктейль /36/6/216;28.0
8504;Кондитерскиеизделия1000;Шоколад  Милки Вей  26гр/36/6;28.0
8502;Кондитерскиеизделия1000;Киндер сюрприз Барби 20 гр. 1/36;94.0
8500;Кондитерскиеизделия1000;Шоколад  Милки Вей  52гр/18/6;65.0
8494;Кондитерскиеизделия1000;Киндер Шоколад50 гр 1/20*8 бл;72.0
8491;Кондитерскиеизделия1000;Шоколад  Марс  50гр 36/8;59.0
8487;Кондитерскиеизделия1000;Шоколад Alpen Gold Темный (DARK) 80гр 1/22;90.0
8484;Кондитерскиеизделия1000;Сникерс супер 80гр 1/4/32;94.0
8483;Кондитерскиеизделия1000;Шоколадный батончик  Кит-Кат  4 пальца 415 гр/27;69.0
8476;Кондитерскиеизделия1000;Шоколад Alpen Gold Фундук/изюм 85гр. 1/21;90.0
8475;Кондитерскиеизделия1000;Шоколад Alpen Gold Капучино 85гр. 1/21;90.0
8474;Кондитерскиеизделия1000;Шоколад Alpen Gold Черника /йогурт 85гр. 1/21;90.0
