12918;МирСоусовСпецийиПриправ242;Горчичный порошок 150гр 1/40 крафт пакет;63.0
12917;МирСоусовСпецийиПриправ242;Смесь пряностей для вкусного блюда курица запеченая с чесноком и паприкой 30гр 1/30;45.0
12906;МирСоусовСпецийиПриправ242;Перец черный молотый 100гр 1/20 (Пакет Дой-пак);90.0
12902;МирСоусовСпецийиПриправ242;Соус соевый Tamaki 470мл 1/6;283.0
12901;МирСоусовСпецийиПриправ242;Соус сладкий чили для курицы Tamaki 470мл 1/6;252.0
12899;МирСоусовСпецийиПриправ242;Соус  Маринад Шашлычный  Tamaki 470мл 1/6;224.0
12898;МирСоусовСпецийиПриправ242;Соус Терияки Tamaki 240мл 1/8;211.0
12896;МирСоусовСпецийиПриправ242;Соус устричный Tamaki 240мл 1/8;210.0
12895;МирСоусовСпецийиПриправ242;Соус соевый Tamaki 240мл 1/8;210.0
12894;МирСоусовСпецийиПриправ242;Соус сладкий чили для курицы Tamaki 240мл 1/8;210.0
12893;МирСоусовСпецийиПриправ242;Соус кунжутный Tamaki 240мл 1/8;210.0
12892;МирСоусовСпецийиПриправ242;Заправка для риса на осн.рисового уксуса Tamaki 240мл 1/8;178.0
12871;МирСоусовСпецийиПриправ242;Соус майонезный Махеевъ Цезарь дой-пак 200гр 1/20;110.0
12870;МирСоусовСпецийиПриправ242;Соус майонезный Махеевъ сырный дой-пак 200гр 1/20;110.0
12868;МирСоусовСпецийиПриправ242;Соус майонезный Махеевъ сливочно-чесночный дой-пак 200гр 1/20;110.0
12867;МирСоусовСпецийиПриправ242;Майонез Махеевъ Оливковый дой-пак 800мл х 10;271.0
12865;МирСоусовСпецийиПриправ242;Горчица Махеевъ Русская дой-пак 140гр 1/18;45.0
12864;МирСоусовСпецийиПриправ242;Аджика Махеевъ острая дой-пак 140гр 1/18;59.0
12863;МирСоусовСпецийиПриправ242;Горчица Махеевъ зернистая дой-пак 140гр 1/18;52.0
12629;МирСоусовСпецийиПриправ242;Соус соевый классический пл/б 200мл 1/24 Мастер Шифу;75.0
12603;МирСоусовСпецийиПриправ242;Кетчуп Хайнц д/п 320гр/16 томатный;118.0
12600;МирСоусовСпецийиПриправ242;Кетчуп Хайнц д/п 320гр/16 гриль\шашлык;118.0
10716;МирСоусовСпецийиПриправ242;Приправа универсальная Букет ароматных трав 1/60/20 (Пакет Дой-пак);43.0
10715;МирСоусовСпецийиПриправ242;Кетчуп Махеев Татарский дой-пак 300гр 1/16;75.0
10705;МирСоусовСпецийиПриправ242;Приправа для мяса 150гр 1/20 (Пакет Дой-пак);101.0
10703;МирСоусовСпецийиПриправ242;Хмели-сунели  Capo di Gusto  30гр 1/25;44.0
10701;МирСоусовСпецийиПриправ242;Приправа для рыбы  Capo di Gusto  30гр 1/30;41.0
10700;МирСоусовСпецийиПриправ242;Соус Чили  Династия Шен  200гр 1/30 с чесноком;32.0
10695;МирСоусовСпецийиПриправ242;Приправа для шашлыка  Capo di Gusto  30гр 1/30;41.0
10691;МирСоусовСпецийиПриправ242;Сенсой Премиум  Заправка для фунчозы-по корейски  пакет 80гр 1/20;84.0
10677;МирСоусовСпецийиПриправ242;Папричи-соус стол. Шашлычный  Грузинская кухня  бут.ст. 320гр 1/6;159.0
10676;МирСоусовСпецийиПриправ242;Приправа для курицы  Capo di Gusto  30гр 1/30;43.0
10669;МирСоусовСпецийиПриправ242;Перец черный молотый 1/50/25 Capo di Gusto;63.0
10668;МирСоусовСпецийиПриправ242;Смесь перцев  Capo di Gusto  50гр 1/25;45.0
10664;МирСоусовСпецийиПриправ242;Сенсой Премиум  Имбирь маринов.  пак.дойпак 300гр 1/18;336.0
10661;МирСоусовСпецийиПриправ242;Майонез  Провансаль Слобода  классический вкк м.д.ж.67% 800мл 1/12;292.0
10657;МирСоусовСпецийиПриправ242;Приправа для моркови по корейски  Capo di Gusto  острая 30гр 1/30;37.0
10646;МирСоусовСпецийиПриправ242;Майонез Махеев с перепелиным яйцом дой пак 400мл 1/20;164.0
10642;МирСоусовСпецийиПриправ242;Кетчуп  Слобода  лечо вк 350гр 1/24 дой пак;81.0
10641;МирСоусовСпецийиПриправ242;Кетчуп  Слобода  шашлычный вк 350гр 1/24 дой пак;100.0
10640;МирСоусовСпецийиПриправ242;Кетчуп  Слобода  томатный вк 350гр 1/24 дой пак;100.0
10634;МирСоусовСпецийиПриправ242;Майонез Махеевъ Оливковый дой-пак 400мл х 20;164.0
10626;МирСоусовСпецийиПриправ242;Дрожжи  Саф-момент  11 гр 1/60;23.0
10623;МирСоусовСпецийиПриправ242;Папричи-соус стол. Барбекю  Американская кухня бут.ст. 320гр 1/6;159.0
10616;МирСоусовСпецийиПриправ242;Приправа Прованские травы 30гр 1/20;84.0
10613;МирСоусовСпецийиПриправ242;Лимонная кислота  Capo di Gusto  20гр 1/40;40.0
10608;МирСоусовСпецийиПриправ242;Папричи-соус стол. Остро-сладкий  Китайская кухня бут.ст. 320гр 1/6;159.0
10605;МирСоусовСпецийиПриправ242;Укроп  Capo di Gusto  10гр 1/25;28.0
10600;МирСоусовСпецийиПриправ242;Приправа для плова  Capo di Gusto  30гр 1/30;41.0
10593;МирСоусовСпецийиПриправ242;Сенсой Премиум  Имбирь маринов.  стекл. бут. 145гр 1/24;231.0
10587;МирСоусовСпецийиПриправ242;Приправа универсальная 150гр 1/20 (Пакет Дой-пак);99.0
10584;МирСоусовСпецийиПриправ242;Дрожжи  Capo di Gusto  20 гр 1/45;28.0
10582;МирСоусовСпецийиПриправ242;Папричи-соус стол. Кисло-сладкий  Китайская кухня бут.ст. 320гр 1/6;159.0
10570;МирСоусовСпецийиПриправ242;Сенсой Премиум Соус  Для обжарки Лапши  пакет 80гр 1/15;101.0
10562;МирСоусовСпецийиПриправ242;Корица молотая  Capo di Gusto  25гр 1/35;40.0
10547;МирСоусовСпецийиПриправ242;Гвоздика цельная  Capo di Gusto  18гр 1/30;82.0
10546;МирСоусовСпецийиПриправ242;Разрыхлитель теста  Capo di Gusto  20гр 1/45;25.0
10542;МирСоусовСпецийиПриправ242;Сенсой  Васаби тюб.43гр 1/24;202.0
10541;МирСоусовСпецийиПриправ242;Приправа для мяса  Capo di Gusto  30гр 1/30;44.0
10539;МирСоусовСпецийиПриправ242;Чеснок  Capo di Gusto  15гр 1/50;45.0
10538;МирСоусовСпецийиПриправ242;Кунжут  Capo di Gusto  15гр 1/50;36.0
10537;МирСоусовСпецийиПриправ242;Перец красный молотый  Capo di Gusto  25гр 1/30;36.0
10535;МирСоусовСпецийиПриправ242;Приправа Заправка для борща 60гр 1/20;84.0
10531;МирСоусовСпецийиПриправ242;Приправа универсальная  Capo di Gusto  30гр 1/30;48.0
10526;МирСоусовСпецийиПриправ242;Кетчуп Лечо Махеевъ 300гр 1/16 Дой Пак;74.0
10517;МирСоусовСпецийиПриправ242;Майонез  Провансаль Слобода  в/к м.д.ж.67% 400мл с доз. 1/24;119.0
10503;МирСоусовСпецийиПриправ242;Петрушка сушеная 1/35/20 Пакет Дой - пак;58.0
10501;МирСоусовСпецийиПриправ242;Желатин  Capo di Gusto  20гр 1/35;58.0
10494;МирСоусовСпецийиПриправ242;Сенсой Премиум  Заправка для моркови-по корейски  пакет 80гр 1/20;95.0
10450;МирСоусовСпецийиПриправ242;Горчица Ядреная Главпродукт 170гр 1/15;64.0
10449;МирСоусовСпецийиПриправ242;Горчица  Русская  170гр 1/15 Главпродукт;58.0
