12494;Салфетки27;Салфетки бумажные ЭлараHOME 2 сл 250шт 1/30;197.0
12493;Салфетки27;Салфетки бумажные ЭлараHOME 2 сл 200шт 1/40;126.0
12372;Салфетки27;Влажные салфетки Yokosun 120шт 1/18;186.0
7619;Салфетки27;Влажные салфетки 80*8 Moony (япония) 1/4;2030.0
7618;Салфетки27;Влажные салфетки 80*3 Moony (япония) 1/8;815.0
7617;Салфетки27;Влажные салфетки 60*8 Moony (япония) 1/4;1865.0
7612;Салфетки27;Детские влажные гигиенич саллфетки Yokosun Eco 10шт 1/120;32.0
6899;Салфетки27;Бумажные салфетки MOMI Family LUX двухсл.220шт 1/60;156.0
6404;Салфетки27;Детские влажные салфетки MOMI 70шт 1/24;190.0
3797;Салфетки27;Влажные салфетки антибактериальные гигиенические YokoSun для всей семьи 108шт 1/18;169.0
3796;Салфетки27;Влажные салфетки антибактериальные гигиенические YokoSun для всей семьи 54шт 1/36;158.0
2816;Салфетки27;Влажная взрослая туалетная бумага YOKOSUN 78шт 1/24;159.0
2815;Салфетки27;Влажная детская туалетная бумага YOKOSUN 68шт 1/24;145.0
2814;Салфетки27;Влажная детская туалетная бумага YOKOSUN 42шт 1/36;132.0
2528;Салфетки27;Бумажные гигиенические салфетки дет. YokoSun  200шт 1/40;140.0
1880;Салфетки27;Влажные салфетки YokoSun ECO 100шт 1/24;115.0
1819;Салфетки27;Влажные салфетки Yokosun 18шт 1/64;54.0
1806;Салфетки27;Влажные салфетки AURA FAMILY с антиб.эф. с крышкой 144шт 1/12;161.0
1451;Салфетки27;Влажные салфетки AURA Family 200шт 1/12 big-pack с крышкой;155.0
1300;Салфетки27;Влажные салфетки детск. MOMI Family 80шт 1/24;173.0
1192;Салфетки27;Влажные салфетки детские  Yokosun  64шт 1/24;125.0
332;Салфетки27;Влажные салфетки AURA Tropic cocktail 15шт 1/110 антибактериальные;13.0
