12938;СгущеноемолокоСливки7;Заменитель сливок  Мастер Крима  05кг 1/20;241.0
12937;СгущеноемолокоСливки7;Заменитель master Milk сухого молока 28% 500г мяг/уп 1/20;234.0
3247;СгущеноемолокоСливки7;Молоко цельное сгущенное Мягкая упаковка ГОСТ Главпродукт 270гр 1/30;85.0
3225;СгущеноемолокоСливки7;Сгущенка Вареная с сахаром Главпродукт 320гр 1/12 туба;117.0
1574;СгущеноемолокоСливки7;Сгущенка Вареная с сахаром Главпродукт 380гр 1/20;126.0
1573;СгущеноемолокоСливки7;Молоко сгущенное ГОСТ 380 гр. 85% 1/20;109.0
